{
  "version": 1,
  "path": "/writings/before-boots-hit-the-trail",
  "pageLikes": {
    "count": 1,
    "actors": [
      "SzmPHEyYHQDooMfxIUkZj9Y0SxY4WcT6yQrQz-hoDUA"
    ]
  },
  "comments": [
    {
      "id": "0a472fa6-5c0c-4f38-8b04-e931462b61ed",
      "name": "Naman",
      "text": "Test",
      "createdAt": "2026-08-16T18:15:57.259Z",
      "likes": {
        "count": 0,
        "actors": []
      },
      "replies": []
    },
    {
      "id": "afbb21e7-01d8-4e63-97b5-f10ae6dec924",
      "name": "Naman",
      "text": "test 2",
      "createdAt": "2026-08-16T18:16:06.700Z",
      "likes": {
        "actors": [
          "SzmPHEyYHQDooMfxIUkZj9Y0SxY4WcT6yQrQz-hoDUA"
        ],
        "count": 1
      },
      "replies": []
    }
  ]
}
