{
  "version": 1,
  "path": "/writings/on-weak-men",
  "pageLikes": {
    "count": 1,
    "actors": [
      "P-A0DRTpi_IOYZfzlvf9xDSGuumCAV0CyK7_BKJSurc"
    ]
  },
  "comments": [
    {
      "id": "15ec25b0-64ed-4335-99c0-0216ce7da7aa",
      "name": "Browser verification",
      "text": "Browser verification 1786899862290 <script>alert(\"no\")</script>",
      "createdAt": "2026-08-16T17:04:25.900Z",
      "likes": {
        "count": 1,
        "actors": [
          "P-A0DRTpi_IOYZfzlvf9xDSGuumCAV0CyK7_BKJSurc"
        ]
      },
      "replies": [
        {
          "id": "3f95b6dd-f792-4b2c-b907-0ee40b7483a3",
          "name": "Browser reply",
          "text": "Reply to Browser verification 1786899862290",
          "createdAt": "2026-08-16T17:04:28.998Z",
          "likes": {
            "count": 1,
            "actors": [
              "P-A0DRTpi_IOYZfzlvf9xDSGuumCAV0CyK7_BKJSurc"
            ]
          }
        }
      ]
    },
    {
      "id": "c91b9b37-9658-4186-9d6d-a4d81ffb9848",
      "name": "Turnstile browser test",
      "text": "Turnstile verification 1786900689939",
      "createdAt": "2026-08-16T17:18:13.809Z",
      "likes": {
        "count": 0,
        "actors": []
      },
      "replies": []
    },
    {
      "id": "b0fe7903-2b18-41b3-b87f-ad94d1d36c93",
      "name": "Turnstile browser test",
      "text": "Turnstile verification 1786900751224",
      "createdAt": "2026-08-16T17:19:15.426Z",
      "likes": {
        "count": 0,
        "actors": []
      },
      "replies": [
        {
          "id": "6e0b7b39-2728-4cbc-9342-f96449745171",
          "name": "Turnstile reply test",
          "text": "Reply to Turnstile verification 1786900751224",
          "createdAt": "2026-08-16T17:19:18.375Z",
          "likes": {
            "count": 0,
            "actors": []
          }
        }
      ]
    },
    {
      "id": "2849fdf8-2d14-4f1a-ae14-894fb804ac86",
      "name": "Turnstile browser test",
      "text": "Turnstile verification 1786900795611",
      "createdAt": "2026-08-16T17:20:00.562Z",
      "likes": {
        "actors": [],
        "count": 0
      },
      "replies": []
    }
  ]
}
